,BasisOfRec,Binomial,CatalogNo,Citation,CollectID,Compiler,Data_sens,Dec_Lat,Dec_Long,Dist_comm,Event_Year,Origin,Presence,Seasonal,Sens_comm,SpatialRef,YrCompiled,recordedBy
651,UNKNOWN,Crateva palmeri,14861,GBIF,,Manuel Vargas,,23.327778,-106.25,Cofradía.,1940.0,1,1,1,,WGS84,2019,H.S. Gentry
652,UNKNOWN,Crateva palmeri,14862,GBIF,,Manuel Vargas,,18.267778,-100.65,Pungarabato.,1934.0,1,1,1,,WGS84,2019,B.D. Hinton
653,UNKNOWN,Crateva palmeri,195253,GBIF,,Manuel Vargas,,16.780556,-99.783333,Copacabana.,1970.0,1,1,1,,WGS84,2019,L.W. Boege
654,UNKNOWN,Crateva palmeri,361715,GBIF,,Manuel Vargas,,19.311111,-103.8,"Colima a Minatitlán, por Peñitas, 10 km al ONO de Colima.",1982.0,1,1,1,,WGS84,2019,
655,UNKNOWN,Crateva palmeri,445355,GBIF,,Manuel Vargas,,19.916667,-103.7,1 km al S de San Martín.,1987.0,1,1,1,,WGS84,2019,A. Flores M.
656,UNKNOWN,Crateva palmeri,513612,GBIF,,Manuel Vargas,,24.786944000000002,-107.08333300000001,"El Espinal, aproximadamente 90 km de Culiacán.",1989.0,1,1,1,,WGS84,2019,
657,UNKNOWN,Crateva palmeri,547333,GBIF,,Manuel Vargas,,24.876110999999998,-106.96666699999999,"Los Mayos, a 70 km de Culiacán, rumbo a Tamazula.",1988.0,1,1,1,,WGS84,2019,R. Vega A. y J.A. Hernández V.
658,UNKNOWN,Crateva palmeri,55767,GBIF,,Manuel Vargas,,17.566111,-101.05,Temixco.,1943.0,1,1,1,,WGS84,2019,J.R. Bruff
659,UNKNOWN,Crateva palmeri,57297,GBIF,,Manuel Vargas,,17.566111,-101.05,Temixco.,1943.0,1,1,1,,WGS84,2019,J.R. Bruff
660,UNKNOWN,Crateva palmeri,57298,GBIF,,Manuel Vargas,,17.566111,-101.05,Temixco.,1943.0,1,1,1,,WGS84,2019,J.R. Bruff
661,UNKNOWN,Crateva palmeri,601118,GBIF,,Manuel Vargas,,22.243333,-104.9,Agua Caliente.,1990.0,1,1,1,,WGS84,2019,O. Bravo B.
662,UNKNOWN,Crateva palmeri,722347,GBIF,,Manuel Vargas,,18.696111,-103.65,Coahuayana de Hidalgo.,1985.0,1,1,1,,WGS84,2019,
663,UNKNOWN,Crateva palmeri,79479,GBIF,,Manuel Vargas,,15.391667000000002,-92.616667,Monte Ovando.,1945.0,1,1,1,,WGS84,2019,E. Matuda
664,UNKNOWN,Crateva palmeri,803789,GBIF,,Manuel Vargas,,19.191667000000002,-104.633333,Arroyo Seco.,1990.0,1,1,1,,WGS84,2019,
665,UNKNOWN,Crateva palmeri,980219,GBIF,,Manuel Vargas,,21.01,-102.1,Tolimán. Barranca del Huisichi.,1996.0,1,1,1,,WGS84,2019,J.A. Machuca y M. Cházaro B.
666,UNKNOWN,Crateva palmeri,990923,GBIF,,Manuel Vargas,,22.054444,-104.91666699999999,"Cerro El Limón, margén izquierdo río San Pedro.",1996.0,1,1,1,,WGS84,2019,J. Sosa L. y M. Zavala M.
2289,PRESERVED_SPECIMEN,Crateva palmeri,162992,GBIF,,Manuel Vargas,,10.33,-85.35,P.N. Palo Verde Estación Palo Verde.Bosque secundario tropical seco.Potreros,1990.0,1,1,1,,WGS84,2019,"Acevedo, Daniel"
2293,PRESERVED_SPECIMEN,Crateva palmeri,168706,GBIF,,Manuel Vargas,,10.35,-85.33,P.N. Palo Verde Estación Palo Verde. Sendero Guayacan,,1,1,1,,WGS84,2019,"Chavarría, Ulises"
2306,PRESERVED_SPECIMEN,Crateva palmeri,182262,GBIF,,Manuel Vargas,,10.34,-85.33,"P.N. Palo Verde Bosque secundario junto a la Laguna Palo Verde, aprox. 1 km O de la pista",1995.0,1,1,1,,WGS84,2019,"Cascante, Alfredo"
5611,PRESERVED_SPECIMEN,Crateva palmeri,021817,GBIF,,Manuel Vargas,,25.987778,-109.04833300000001,Pie de sierra de Barobampo,1999.0,1,1,1,,WGS84,2019,RVA; JAGG
5612,PRESERVED_SPECIMEN,Crateva palmeri,001921,GBIF,,Manuel Vargas,,24.122778,-106.894444,"El Espinal, a 90 km  de Culiacan.",1989.0,1,1,1,,WGS84,2019,RVA; IFVL; MAL
5613,PRESERVED_SPECIMEN,Crateva palmeri,008319,GBIF,,Manuel Vargas,,24.995832999999998,-107.80416699999999,Cerros de Caimanero a 5 km al O del poblado.,1987.0,1,1,1,,WGS84,2019,RVA; GBB
5622,PRESERVED_SPECIMEN,Crateva palmeri,,GBIF,9924,Manuel Vargas,,17.91444,-101.79389,About 1-2 km north of Hwy 200 along road to Chutla de Nava,2005.0,1,1,1,,WGS84,2019,Mitch Provance
7311,PRESERVED_SPECIMEN,Crateva palmeri,,GBIF,11315,Manuel Vargas,,10.0114,-83.9519,,,1,1,1,,WGS84,2019,W. C. Burger & et al.
7957,PRESERVED_SPECIMEN,Crateva palmeri,100143640,GBIF,González Ramírez 2378,Manuel Vargas,,10.253333,-85.317222,"H. Palustrino Corral de Piedra. Cuenca del Tempisque. Quebrada Honda. Camino que rodea el Cerro Corral de Piedra, hasta el estero del mismo nombre, charrales y bosques intervenidos.",2002.0,1,1,1,,WGS84,2019,José Á. González R.|Y. Cardenas
8238,PRESERVED_SPECIMEN,Crateva palmeri,100256150,GBIF,Stevens 29607,Manuel Vargas,,12.404167,-85.845833,Km 63 of Carretera al Rama; dry forest,2010.0,1,1,1,,WGS84,2019,W. D. Stevens|O.M. Montiel J.
8409,PRESERVED_SPECIMEN,Crateva palmeri,100391349,GBIF,Stevens 31689,Manuel Vargas,,12.628611,-86.04305500000001,1.2 km E of Carretera Norte on road along N shore of Laguna Tecomapa; dry forest between road and lake,2011.0,1,1,1,,WGS84,2019,W. D. Stevens|O.M. Montiel J.
8744,PRESERVED_SPECIMEN,Crateva palmeri,100489326,GBIF,Santamaría-Aguilar 1031,Manuel Vargas,,9.938858,-84.894153,No protegida.  Golfo de Nicoya Externo.  Isla San Lucas.,2005.0,1,1,1,,WGS84,2019,Daniel Santamaría|J. F. Morales|Armando Soto|Frank González
9128,PRESERVED_SPECIMEN,Crateva palmeri,100519824,GBIF,Rueda 18706,Manuel Vargas,,13.233332999999998,-86.35,"Reserva Natural de Miraflor, comunidad de Fátima, Río Naranjo de Fátima",2012.0,1,1,1,,WGS84,2019,R.M. Rueda|I. Coronado G.|J. Reyes
9295,PRESERVED_SPECIMEN,Crateva palmeri,100563205,GBIF,Stevens 33603,Manuel Vargas,,13.610889000000002,-86.451444,2.7 km E of Panamerican Highway (at 0.2 km S of Río Coco bridge just S of Ocotal) along road through Yaraje to El Zapote.,2012.0,1,1,1,,WGS84,2019,W. D. Stevens|O.M. Montiel J.
9297,PRESERVED_SPECIMEN,Crateva palmeri,100563689,GBIF,Stevens 33800,Manuel Vargas,,11.087278,-85.715944,6.9 km SW of Puente El Ostional along road to Costa Rica border; dry forest on shale slopes and rocky shore,2012.0,1,1,1,,WGS84,2019,W. D. Stevens|O.M. Montiel J.
9318,PRESERVED_SPECIMEN,Crateva palmeri,100574201,GBIF,Palmer 1285,Manuel Vargas,,18.934722,-103.965,Armería.,1891.0,1,1,1,,WGS84,2019,Edward Palmer
10098,PRESERVED_SPECIMEN,Crateva palmeri,MA-01-00734345,GBIF,2378,Manuel Vargas,,10.2533,-85.3172,"Guanacaste: Nicoya. H. Palustrino Corral de Piedra. Cuenca del Tempisque. Quebrada Honda. Camino que rodea el Cerro Corral de Piedra, hastae el estero del mismo nombre,",2002.0,1,1,1,,WGS84,2019,J. González & al.
10766,PRESERVED_SPECIMEN,Crateva palmeri,,GBIF,154,Manuel Vargas,,19.379170000000002,-104.98333000000001,"Rancho Cuixmala, along Rio Cuixmala, near headquarters",1991.0,1,1,1,,WGS84,2019,"B.M. Rothschild; Ma. Guadalupe Ayala, S.Vazquez C."
10767,PRESERVED_SPECIMEN,Crateva palmeri,,GBIF,3241,Manuel Vargas,,19.46667,-104.93333,"Rancho Cuixmala, road to Parque El Caiman, south side of Rio Cuitzmala, c. 2 km E of the Puerto Vallarta - Barra de Navidad (MEX 200) Hwy",1991.0,1,1,1,,WGS84,2019,E.J. Lott; et al.
10768,PRESERVED_SPECIMEN,Crateva palmeri,,GBIF,10490,Manuel Vargas,,19.383329999999997,-104.98167,Rancho Cuixmala; immediately north of Rio Cuitzmala and west of Hwy 200 (Puerto Vallarta - Barra la Navidad Hwy).,1991.0,1,1,1,,WGS84,2019,"A.C. Sanders; D. Charlton, B. Phillips, B. Rothschild"
10769,PRESERVED_SPECIMEN,Crateva palmeri,,GBIF,31136,Manuel Vargas,,19.65833,-104.075,"Upper (outer) floodplain, in the deep valley of Río Ajuquila, on the NE edge of Zenzontla, 22 km SE of El Grullo",1994.0,1,1,1,,WGS84,2019,H.H. Iltis; F.J. Santana M.
10770,PRESERVED_SPECIMEN,Crateva palmeri,,GBIF,5640,Manuel Vargas,,19.66056,-104.08028,6 km al E de Tuxcacuesco. Zenzontla,,1,1,1,,WGS84,2019,F.J. Santana M.; B.F. Benz
10950,PRESERVED_SPECIMEN,Crateva palmeri,ASU0038874,GBIF,5467,Manuel Vargas,,18.333333,-100.65,"Pungarabato, Coyuca.",1934.0,1,1,1,,WGS84,2019,Geo. B. Hinton
11251,PRESERVED_SPECIMEN,Crateva palmeri,G-G-147522/4,GBIF,,Manuel Vargas,,10.25333,-85.31721999999999,"Guanacaste - Guanacaste: Nicoya. H. Palustrino Corral de Piedra. Cuenca del Tempisque. Quebrada Honda. Camino que rodea el Cerro Corral de Piedra, hasta el estero del mismo nombre, charrales y bosques intervenidos/Provincia de Guanacaste",2002.0,1,1,1,,WGS84,2019,"González, J. & Y. Cárdenas"
11992,PRESERVED_SPECIMEN,Crateva palmeri,1528456,GBIF,,Manuel Vargas,,10.433333,-85.261111,Bagactzi.,1996.0,1,1,1,,WGS84,2019,Alexánder Francisco Rodríguez González; Victor Ramírez
11993,PRESERVED_SPECIMEN,Crateva palmeri,1528454,GBIF,,Manuel Vargas,,10.433333,-85.261111,Bagactzi.,1996.0,1,1,1,,WGS84,2019,Alexánder Francisco Rodríguez González; Victor Ramírez
11994,PRESERVED_SPECIMEN,Crateva palmeri,1528455,GBIF,,Manuel Vargas,,10.433333,-85.261111,Bagactzi.,1996.0,1,1,1,,WGS84,2019,Alexánder Francisco Rodríguez González; Victor Ramírez
11995,PRESERVED_SPECIMEN,Crateva palmeri,1528453,GBIF,,Manuel Vargas,,10.433333,-85.261111,Bagactzi.,1996.0,1,1,1,,WGS84,2019,Alexánder Francisco Rodríguez González; Victor Ramírez
12656,PRESERVED_SPECIMEN,Crateva palmeri,1557121,GBIF,,Manuel Vargas,,10.35,-85.333333,Sendero Guayacan.,1991.0,1,1,1,,WGS84,2019,Ulises Chavarría
12762,PRESERVED_SPECIMEN,Crateva palmeri,1559682,GBIF,,Manuel Vargas,,10.333333,-85.352778,"Estacion Palo Verde. Bosque secundario, tropical seco. Potreros.",1990.0,1,1,1,,WGS84,2019,Daniel Acevedo
17195,PRESERVED_SPECIMEN,Crateva palmeri,3108811,GBIF,,Manuel Vargas,,10.408333,-85.35,"Llano de Cortes, 5 Km antes de entrada a Palo Verde, suelo semi-inundado.",1999.0,1,1,1,,WGS84,2019,Alexánder Francisco Rodríguez González; Victor Ramírez
17196,PRESERVED_SPECIMEN,Crateva palmeri,3108809,GBIF,,Manuel Vargas,,10.408333,-85.35,"Llano de Cortes, 5 Km antes de entrada a Palo Verde, suelo semi-inundado.",1999.0,1,1,1,,WGS84,2019,Alexánder Francisco Rodríguez González; Victor Ramírez
17197,PRESERVED_SPECIMEN,Crateva palmeri,3108810,GBIF,,Manuel Vargas,,10.408333,-85.35,"Llano de Cortes, 5 Km antes de entrada a Palo Verde, suelo semi-inundado.",1999.0,1,1,1,,WGS84,2019,Alexánder Francisco Rodríguez González; Victor Ramírez
18005,PRESERVED_SPECIMEN,Crateva palmeri,3429823,GBIF,,Manuel Vargas,,10.348185,-85.361473,"P.N. Palo Verde, Camino a Puerto Chamorro",2000.0,1,1,1,,WGS84,2019,L. Acosta; Geovanny Sancho ; Gerardo Soto
18790,PRESERVED_SPECIMEN,Crateva palmeri,3751677,GBIF,,Manuel Vargas,,10.253385,-85.31735400000001,"Nicoya, Humedal Corral de Piedra.",2002.0,1,1,1,,WGS84,2019,Jose González; Yow Cárdenas
18791,PRESERVED_SPECIMEN,Crateva palmeri,3751680,GBIF,,Manuel Vargas,,10.253385,-85.31735400000001,"Nicoya, Humedal Corral de Piedra.",2002.0,1,1,1,,WGS84,2019,Jose González; Yow Cárdenas
18792,PRESERVED_SPECIMEN,Crateva palmeri,3751676,GBIF,,Manuel Vargas,,10.253385,-85.31735400000001,"Nicoya, Humedal Corral de Piedra.",2002.0,1,1,1,,WGS84,2019,Jose González; Yow Cárdenas
18793,PRESERVED_SPECIMEN,Crateva palmeri,3751678,GBIF,,Manuel Vargas,,10.253385,-85.31735400000001,"Nicoya, Humedal Corral de Piedra.",2002.0,1,1,1,,WGS84,2019,Jose González; Yow Cárdenas
18795,PRESERVED_SPECIMEN,Crateva palmeri,3751681,GBIF,,Manuel Vargas,,10.253385,-85.31735400000001,"Nicoya, Humedal Corral de Piedra.",2002.0,1,1,1,,WGS84,2019,Jose González; Yow Cárdenas
18796,PRESERVED_SPECIMEN,Crateva palmeri,3751679,GBIF,,Manuel Vargas,,10.253385,-85.31735400000001,"Nicoya, Humedal Corral de Piedra.",2002.0,1,1,1,,WGS84,2019,Jose González; Yow Cárdenas
19970,PRESERVED_SPECIMEN,Crateva palmeri,3941658,GBIF,,Manuel Vargas,,9.938858,-84.894153,Isla San Lucas.,2005.0,1,1,1,,WGS84,2019,Daniel Santamaría; Juan Francisco Morales Quirós ; Armando Soto ; Frank  Alonso González Brenes
19971,PRESERVED_SPECIMEN,Crateva palmeri,3941657,GBIF,,Manuel Vargas,,9.938858,-84.894153,Isla San Lucas.,2005.0,1,1,1,,WGS84,2019,Daniel Santamaría; Juan Francisco Morales Quirós ; Armando Soto ; Frank  Alonso González Brenes
19972,PRESERVED_SPECIMEN,Crateva palmeri,3941656,GBIF,,Manuel Vargas,,9.938858,-84.894153,Isla San Lucas.,2005.0,1,1,1,,WGS84,2019,Daniel Santamaría; Juan Francisco Morales Quirós ; Armando Soto ; Frank  Alonso González Brenes
19978,PRESERVED_SPECIMEN,Crateva palmeri,3942215,GBIF,,Manuel Vargas,,9.945155,-84.912402,Isla San Lucas.,2005.0,1,1,1,,WGS84,2019,Alexánder Francisco Rodríguez González; Juan Francisco Morales Quirós ; Armando Soto ; Daniel Santamaría ; Frank  Alonso González Brenes
19979,PRESERVED_SPECIMEN,Crateva palmeri,3942216,GBIF,,Manuel Vargas,,9.945155,-84.912402,Isla San Lucas.,2005.0,1,1,1,,WGS84,2019,Alexánder Francisco Rodríguez González; Juan Francisco Morales Quirós ; Armando Soto ; Daniel Santamaría ; Frank  Alonso González Brenes
19980,PRESERVED_SPECIMEN,Crateva palmeri,3942218,GBIF,,Manuel Vargas,,9.945155,-84.912402,Isla San Lucas.,2005.0,1,1,1,,WGS84,2019,Alexánder Francisco Rodríguez González; Juan Francisco Morales Quirós ; Armando Soto ; Daniel Santamaría ; Frank  Alonso González Brenes
19981,PRESERVED_SPECIMEN,Crateva palmeri,3942214,GBIF,,Manuel Vargas,,9.945155,-84.912402,Isla San Lucas.,2005.0,1,1,1,,WGS84,2019,Alexánder Francisco Rodríguez González; Juan Francisco Morales Quirós ; Armando Soto ; Daniel Santamaría ; Frank  Alonso González Brenes
19982,PRESERVED_SPECIMEN,Crateva palmeri,3942217,GBIF,,Manuel Vargas,,9.945155,-84.912402,Isla San Lucas.,2005.0,1,1,1,,WGS84,2019,Alexánder Francisco Rodríguez González; Juan Francisco Morales Quirós ; Armando Soto ; Daniel Santamaría ; Frank  Alonso González Brenes
23082,PRESERVED_SPECIMEN,Crateva palmeri,4238274,GBIF,,Manuel Vargas,,10.347333,-85.35213900000001,"P. N. Palo Verde, sector entre el Corral y cruce al Colmenar.",2007.0,1,1,1,,WGS84,2019,L. Acosta; Diego Castillo ; Guillermo Villalobos
23835,PRESERVED_SPECIMEN,Crateva palmeri,4409890,GBIF,,Manuel Vargas,,10.345833,-85.344444,Sector Palo Verde.,2014.0,1,1,1,,WGS84,2019,Nelson A. Zamora Villalobos; Soo-Yong Kim ; Guillermo Villalobos ; Jose Antonio Azofeifa Zuñiga
23836,PRESERVED_SPECIMEN,Crateva palmeri,4409889,GBIF,,Manuel Vargas,,10.345833,-85.344444,Sector Palo Verde.,2014.0,1,1,1,,WGS84,2019,Nelson A. Zamora Villalobos; Soo-Yong Kim ; Guillermo Villalobos ; Jose Antonio Azofeifa Zuñiga
23837,PRESERVED_SPECIMEN,Crateva palmeri,4409888,GBIF,,Manuel Vargas,,10.345833,-85.344444,Sector Palo Verde.,2014.0,1,1,1,,WGS84,2019,Nelson A. Zamora Villalobos; Soo-Yong Kim ; Guillermo Villalobos ; Jose Antonio Azofeifa Zuñiga
30357,PRESERVED_SPECIMEN,Crateva palmeri,1015,GBIF,,Manuel Vargas,,24.87611,-106.97556000000002,"Los Mayos, a 70 km de Culiacán, rumbo a Tamazula",1988.0,1,1,1,,WGS84,2019,Rito Vega
31432,PRESERVED_SPECIMEN,Crateva palmeri,66724,GBIF,,Manuel Vargas,,18.469610999999997,-101.83730600000001,"Matamoros de Guerrero, 2.71 km al N",1999.0,1,1,1,,WGS84,2019,Jorge Calónico Soto; Rafael Mayorga Saucedo
31486,PRESERVED_SPECIMEN,Crateva palmeri,DES00004602,GBIF,5467,Manuel Vargas,,18.333333,-100.65,"Pungarabato, Coyuca.",1934.0,1,1,1,,WGS84,2019,Geo. B. Hinton; et al.
33003,PRESERVED_SPECIMEN,Crateva palmeri,100962065,GBIF,Stevens 39103,Manuel Vargas,,11.690444,-86.31875,5.1 km SE of Empalme La Trinidad; dry forest,2017.0,1,1,1,,WGS84,2019,W. D. Stevens
33061,PRESERVED_SPECIMEN,Crateva palmeri,101009324,GBIF,Martínez Velázquez 74,Manuel Vargas,,16.388361,-94.57669399999999,"Mpio. San Francisco del Mar. Predio Rancho San Cristóbal, Paraje El Plan, conglomerado 75956 del Inventario Nacional Forestal y de Suelos.",2013.0,1,1,1,,WGS84,2019,Esteban Martínez Velázquez
33090,PRESERVED_SPECIMEN,Crateva palmeri,101042501,GBIF,Stevens 40203,Manuel Vargas,,12.630195,-86.035555,"Along N shore of Laguna Tecomapa, 2.3 km E of Km 75 of Panamerican Highway; black mud on receding lake margin",2018.0,1,1,1,,WGS84,2019,W. D. Stevens
33663,PRESERVED_SPECIMEN,Crateva palmeri,170976,GBIF,,Manuel Vargas,,18.688889,-102.07777800000001,"Sierra las Cruces, ca. 6.5 km (by air) W- SW of Los Ranchos, along the trail to Ciénega del Plátano",2003.0,1,1,1,,WGS84,2019,V. W. Steinmann; E. Carranza G.
33664,PRESERVED_SPECIMEN,Crateva palmeri,219037,GBIF,,Manuel Vargas,,18.004556,-102.433472,"Rancho El Malacate, ± 2 km al S de Solera de Agua",2009.0,1,1,1,,WGS84,2019,V. W. Steinmann; Y. Ramírez-Amezcua
35015,PRESERVED_SPECIMEN,Crateva palmeri,3025327,GBIF,Moreno 28918,Manuel Vargas,,13.233329999999999,-86.35,"Km 166, carretera a Kukamonga",1998.0,1,1,1,,WGS84,2019,P. P. Moreno
35513,PRESERVED_SPECIMEN,Crateva palmeri,3225872,GBIF,Danin 76-11-4,Manuel Vargas,,12.31666,-86.1,"14 km N of Tipitapa; cracked grumusol, dominance of Acacia costaricensis  [pennatula] and Haematoxylum brasiletto",1976.0,1,1,1,,WGS84,2019,Avinoam Danin
35514,PRESERVED_SPECIMEN,Crateva palmeri,3225891,GBIF,Danin 76-12-14,Manuel Vargas,,12.35,-86.05,"17 km N of Tipitapa; red soil, patches with dominance of Lonchocarpus and Cassia [Senna]",1976.0,1,1,1,,WGS84,2019,Avinoam Danin
36430,PRESERVED_SPECIMEN,Crateva palmeri,3600065,GBIF,Hinton 15863,Manuel Vargas,,18.59,-103.5,Aquila,1941.0,1,1,1,,WGS84,2019,George B. Hinton|James C. Hinton
36459,PRESERVED_SPECIMEN,Crateva palmeri,3616340,GBIF,Hinton 5467,Manuel Vargas,,18.346667,-100.652222,"Pungarabato, District Coyuca. [some labels may be as District Mina. Coyuca and Mina are alternate names]",1934.0,1,1,1,,WGS84,2019,George B. Hinton
36460,PRESERVED_SPECIMEN,Crateva palmeri,3616616,GBIF,Hinton 5731,Manuel Vargas,,18.377222,-100.701667,District Coyuca. Coyuca-Ancón.,1934.0,1,1,1,,WGS84,2019,George B. Hinton
36462,PRESERVED_SPECIMEN,Crateva palmeri,3616774,GBIF,Hinton 5886,Manuel Vargas,,18.92,-100.17,Calera,1934.0,1,1,1,,WGS84,2019,George B. Hinton
37378,PRESERVED_SPECIMEN,Crateva palmeri,59407,GBIF,Moreno 21287,Manuel Vargas,,12.33333,-86.01666,"Hacienda San Jacinto, carretera Norte",1983.0,1,1,1,,WGS84,2019,P. P. Moreno
37382,PRESERVED_SPECIMEN,Crateva palmeri,60058,GBIF,Stevens 22953,Manuel Vargas,,12.366660000000001,-85.86666,W slope of Cerro Coyanchigua; series of weathered basaltic lava mesas; scrub forest,1984.0,1,1,1,,WGS84,2019,W. D. Stevens
37383,PRESERVED_SPECIMEN,Crateva palmeri,60074,GBIF,Stevens 22993,Manuel Vargas,,12.26666,-85.65,"Quebrada Los Encuentros, NW of Tecolostote; gallery forest",1984.0,1,1,1,,WGS84,2019,W. D. Stevens
37384,PRESERVED_SPECIMEN,Crateva palmeri,60095,GBIF,Araquistain 3446,Manuel Vargas,,12.616660000000001,-86.05,Sector de Puertas Viejas,1983.0,1,1,1,,WGS84,2019,M. Araquistain
37385,PRESERVED_SPECIMEN,Crateva palmeri,60113,GBIF,Araquistain 3603,Manuel Vargas,,12.616660000000001,-86.05,Camino de Puertas Viejas; bosque tropical seco a bosque tropical premontano,1983.0,1,1,1,,WGS84,2019,M. Araquistain
37386,PRESERVED_SPECIMEN,Crateva palmeri,60614,GBIF,Castro 65,Manuel Vargas,,11.116660000000001,-85.75,Río El Ostional,1984.0,1,1,1,,WGS84,2019,M. Castro
37387,PRESERVED_SPECIMEN,Crateva palmeri,61181,GBIF,Miller 658,Manuel Vargas,,18.56,-100.96,"11 km W of Huetamo de Nunez on dirt road to Nueva Italia. Short deciduous forest with Cordia elaeagnoides. Elev. 250 m. 18.34'N, 100.58'W.",1983.0,1,1,1,,WGS84,2019,James S. Miller|Pedro Tenorio L.
37388,PRESERVED_SPECIMEN,Crateva palmeri,61393,GBIF,Moreno 24340,Manuel Vargas,,12.433333,-85.733333,"Finca San Antonio, 9 km al SW de Boaco",1984.0,1,1,1,,WGS84,2019,P. P. Moreno
37806,PRESERVED_SPECIMEN,Crateva palmeri,780364,GBIF,Chavarría García 454,Manuel Vargas,,10.35,-85.333333,Parque Nacional Palo Verde Sendero Guayacán.,1991.0,1,1,1,,WGS84,2019,Ulises Chavarría
38147,PRESERVED_SPECIMEN,Crateva palmeri,14861,GBIF,,Manuel Vargas,,23.327778,-106.255556,Cofradía.,1940.0,1,1,1,,WGS84,2019,H.S. Gentry
38148,PRESERVED_SPECIMEN,Crateva palmeri,57298,GBIF,,Manuel Vargas,,17.566111,-101.05583299999999,Temisco.,1943.0,1,1,1,,WGS84,2019,J.R. Bruff
38149,PRESERVED_SPECIMEN,Crateva palmeri,57297,GBIF,,Manuel Vargas,,17.566111,-101.05583299999999,Temisco.,1943.0,1,1,1,,WGS84,2019,J.R. Bruff
38620,PRESERVED_SPECIMEN,Crateva palmeri,597,GBIF,,Manuel Vargas,,17.566667000000002,-101.429167,Laguna El Carrizal,1989.0,1,1,1,,WGS84,2019,N. Diego
38621,PRESERVED_SPECIMEN,Crateva palmeri,2934,GBIF,,Manuel Vargas,,17.586389,-101.45,"Playa Blanca, laguna",1989.0,1,1,1,,WGS84,2019,N. Diego
39808,PRESERVED_SPECIMEN,Crateva palmeri,143422,GBIF,,Manuel Vargas,,19.570375,-103.842558,"BARRANCA DEL HUISICHI, MPIO. TOLIMAN, JAL.",1996.0,1,1,1,,WGS84,2019,J. A. Machuca N.; M. Cházaro B.
39809,PRESERVED_SPECIMEN,Crateva palmeri,20958,GBIF,,Manuel Vargas,,20.325,-105.325,A LARGE TRIANGLE OF LAND JUTTING INTO THE PACIFIC OCEAN 15-78 KM SW OF PUERTO VALLARTA,1990.0,1,1,1,,WGS84,2019,T.S. Cochrane; et al.
39810,PRESERVED_SPECIMEN,Crateva palmeri,20959,GBIF,,Manuel Vargas,,19.236667,-104.563333,"ARROYO SECO, MPIO. CIHUATLAN, JAL.",1990.0,1,1,1,,WGS84,2019,A. Rodríguez C.; et al.
39811,PRESERVED_SPECIMEN,Crateva palmeri,20957,GBIF,,Manuel Vargas,,21.681667,-103.813333,"1 KM AL S DE SAN MARTIN, CAMINO AL PANTEON, MPIO. SAN MARTIN BOLAÑOS, JAL.",1987.0,1,1,1,,WGS84,2019,A. Flores M.
39812,PRESERVED_SPECIMEN,Crateva palmeri,155662,GBIF,,Manuel Vargas,,21.094444,-103.438889,"IXCAMILPA, 6 KM AL NNW DE SAN CRISTOBAL DE LA BARRANCA (EN LINEA RECTA) POR EL RIO CUIXTLA, MPIO. SAN CRISTOBAL DE LA BARRANCA, JAL.",2001.0,1,1,1,,WGS84,2019,P. Carrillo; et al.
39813,PRESERVED_SPECIMEN,Crateva palmeri,152476,GBIF,,Manuel Vargas,,21.054920000000003,-103.43276,"LA PATALARGA, 1.5 KM AL NNW DE SAN CRISTOBAL DE LA BARRANCA POR EL RIO CUIXTLA, MPIO. SAN CRISTOBAL DE LA BARRANCA, JAL.",2000.0,1,1,1,,WGS84,2019,P. Carrillo R.; R. Bello
39814,PRESERVED_SPECIMEN,Crateva palmeri,163378,GBIF,,Manuel Vargas,,18.375,-101.908333,"ALONG THE ROAD TO INFIERNILLO, CA. 29 KM SSE OF THE JUNCTION WITH MEX 37, MPIO. ARTEAGA, MICH.",2002.0,1,1,1,,WGS84,2019,V. W. Steinmann; E. Carranza G.
39815,PRESERVED_SPECIMEN,Crateva palmeri,20956,GBIF,,Manuel Vargas,,19.658333,-104.08,1 KM SW OF ZENZONTLA (ACUEDUCTO CERCA DEL OJO DE AGUA),1989.0,1,1,1,,WGS84,2019,T.S. Cochrane; et al.
40199,PRESERVED_SPECIMEN,Crateva palmeri,017060,GBIF,,Manuel Vargas,,25.0,-107.375,"A 41 km al N de Culiacán, carretera Tepuche a Peñas Blancas.",1995.0,1,1,1,,WGS84,2019,Vega Aviña Rito; Gutiérrez G. Juan A.; Hernández V. Jorge A.
40200,PRESERVED_SPECIMEN,Crateva palmeri,017291,GBIF,,Manuel Vargas,,24.524444,-107.112778,"El Salado, alrededor de El Alamo, a orilla de arroyo.",1995.0,1,1,1,,WGS84,2019,Bojórquez Bojórquez Germán Aurelio; Gutiérrez G. Juan A.; Hernández V. Jorge A.
40201,PRESERVED_SPECIMEN,Crateva palmeri,013180,GBIF,,Manuel Vargas,,24.45,-107.08333300000001,"A 50 km al S de Culiacán, carretera Culiacán a Mazatlán, Tabalá, cerca del río San Lorenzo. - TABALA",1994.0,1,1,1,,WGS84,2019,Vega Aviña Rito; Bojórquez B. Germán A.; Hernández A. Faustino
40202,PRESERVED_SPECIMEN,Crateva palmeri,001923,GBIF,,Manuel Vargas,,24.361667,-107.075,A 300 m al N del poblado de Tacuichamona. - TACUICHAMONA,1984.0,1,1,1,,WGS84,2019,Valverde Rodríguez José Luis; Siqueiros Z. Gastón
40203,PRESERVED_SPECIMEN,Crateva palmeri,017189,GBIF,,Manuel Vargas,,25.095,-107.406667,"A 2 km al O del poblado El Varejonal, orilla del río Humaya, ladera S del cerro. - VAREJONAL",1995.0,1,1,1,,WGS84,2019,Vega Aviña Rito; Vega L. Rito M.
40204,PRESERVED_SPECIMEN,Crateva palmeri,016307,GBIF,,Manuel Vargas,,24.936111,-107.233333,"A 20 km al NE de Culiacán, cercanías de El Pozo, brecha El Pozo a La Cuesta.",1994.0,1,1,1,,WGS84,2019,Vega Aviña Rito; Gutiérrez G. Juan A.; López U. Guadalupe A.
40205,PRESERVED_SPECIMEN,Crateva palmeri,017292,GBIF,,Manuel Vargas,,24.191389,-106.979722,Camino Baila a Binapa. - BAILA,1995.0,1,1,1,,WGS84,2019,Vega Aviña Rito; Vega L. Inés F.; Vega L. Rito M.
40206,PRESERVED_SPECIMEN,Crateva palmeri,001922,GBIF,,Manuel Vargas,,24.168056,-107.0125,"A 73 km al S de Culiacán, carretera Culiacán a Mazatlán, a orilla de carretera.",1987.0,1,1,1,,WGS84,2019,Vega Aviña Rito; Martínez V. Alfonso; Vega L. Inés F.
40207,PRESERVED_SPECIMEN,Crateva palmeri,001920,GBIF,,Manuel Vargas,,24.876667,-106.978333,"A 70 km al E de Culiacán, camino Culiacán a Tamazula.",1988.0,1,1,1,,WGS84,2019,Vega Aviña Rito; Hernández V. Jorge A.
40208,PRESERVED_SPECIMEN,Crateva palmeri,013759,GBIF,,Manuel Vargas,,24.713889,-107.35,"A 5 km al S de Culiacán, carretera Culiacán a Mazatlán, cerro El Tule, camino a la estación de microondas.",1994.0,1,1,1,,WGS84,2019,Vega Aviña Rito; Bojórquez B. Germán A.; Hernández V. Jorge A.; Gutiérrez G. Juan
40386,PRESERVED_SPECIMEN,Crateva palmeri,12032,GBIF,,Manuel Vargas,,19.660556,-104.080278,6 km al E de Tuxcacuesco,1992.0,1,1,1,,WGS84,2019,Francisco Javier Santana Michel; Bruce Benz
40387,PRESERVED_SPECIMEN,Crateva palmeri,6835,GBIF,,Manuel Vargas,,19.651667,-104.08416700000001,"3-4 km al SO de Zenzontla, 13-14 km al SE de El Chante",1989.0,1,1,1,,WGS84,2019,Theodore Cochrane; Mark Wetter
40388,PRESERVED_SPECIMEN,Crateva palmeri,5202,GBIF,,Manuel Vargas,,19.636111,-104.03694399999999,"0.5-1 km al SSE de El Camichín, 9-10 km al SO de Tuxcacuesco",1988.0,1,1,1,,WGS84,2019,Luis Guzmán Hernández; Ramón Cuevas Guzmán
40389,PRESERVED_SPECIMEN,Crateva palmeri,10027,GBIF,,Manuel Vargas,,19.66,-104.07055600000001,0.5 km de Zenzontla,1989.0,1,1,1,,WGS84,2019,Luis Robles Hernández; Domitila De Niz Lara
40390,PRESERVED_SPECIMEN,Crateva palmeri,2384,GBIF,,Manuel Vargas,,19.641667,-104.091667,1-2 km al E de La Cañita,1987.0,1,1,1,,WGS84,2019,Ramón Cuevas Guzmán
40391,PRESERVED_SPECIMEN,Crateva palmeri,2291,GBIF,,Manuel Vargas,,19.641667,-104.091667,1 km al E de La Cañita,1987.0,1,1,1,,WGS84,2019,Ramón Cuevas Guzmán; Luis Guzmán Hernández
40392,PRESERVED_SPECIMEN,Crateva palmeri,14667,GBIF,,Manuel Vargas,,19.332222,-103.815556,"Al SE de Cerro Grande, 13 km al NO de Colima",1991.0,1,1,1,,WGS84,2019,Theodore Cochrane; José Antonio Vázquez García; Agustín Flores Macias
42667,PRESERVED_SPECIMEN,Crateva palmeri,BM001172320,GBIF,33603,Manuel Vargas,,13.6108,-86.4514,2.7 km E of Panamerican Highway (at 0.2 km S of Río Coco bridge just S of Ocotal) along road through Yaraje to El Zapote,2012.0,1,1,1,,WGS84,2019,"Warren Douglas (Doug) Stevens; b.1944; W.D.Stevens, Olga Martha Montiel Jarquin; b.1951; Montiel"
