,BasisOfRec,Binomial,CatalogNo,Citation,CollectID,Compiler,Data_sens,Dec_Lat,Dec_Long,Dist_comm,Event_Year,Origin,Presence,Seasonal,Sens_comm,SpatialRef,YrCompiled,recordedBy
40057,PRESERVED_SPECIMEN,Garrya laurifolia,56716,GBIF,,Manuel Vargas,,19.131667,-97.076667,"ESCOLA, CAMINO A XAMATICPAC, BARRANCA DEL RIO JAMAPA",1985.0,1,1,1,,WGS84,2019,J.L. Martínez P.; F. Vázquez B.
40058,PRESERVED_SPECIMEN,Garrya laurifolia,56671,GBIF,,Manuel Vargas,,19.895,-101.428333,"SW DE PEDREGAL PEQUEÑO, 2 KM AL SW DE TENDEPARACUA",1993.0,1,1,1,,WGS84,2019,P. Silva-Sáenz
40059,PRESERVED_SPECIMEN,Garrya laurifolia,56664,GBIF,,Manuel Vargas,,19.766667,-100.216667,"CERRO DE LA PEñA BLANCA, CUATRO KM AL NO DE SAN FRANCISCO DE LOS REYES",1992.0,1,1,1,,WGS84,2019,M. Cházaro B.; I. García; R. Acevedo R.; M. Huerta M.; G
40060,PRESERVED_SPECIMEN,Garrya laurifolia,56718,GBIF,,Manuel Vargas,,19.636667000000003,-103.67,"15 KM AL S DE FLORIPONDIO, BRECHA A LOS GARCIA, MPIO. VENUSTIANO CARRANZA",1990.0,1,1,1,,WGS84,2019,J. Villa C.; J. Chávez L.
40061,PRESERVED_SPECIMEN,Garrya laurifolia,56726,GBIF,,Manuel Vargas,,17.105,-96.711667,"CERRO SAN FELIPE, MPIO. OAXACA",1985.0,1,1,1,,WGS84,2019,A. Saynes V.
40062,PRESERVED_SPECIMEN,Garrya laurifolia,162834,GBIF,,Manuel Vargas,,19.658333,-100.275,"ESTACION CHINCUA, RESERVA DE LA BIOSFERA MARIPOSA MONARCA, MPIO. ANGANGUEO, MICH.",2001.0,1,1,1,,WGS84,2019,M. G. Cornejo T.; G. Ibarra M.
40063,PRESERVED_SPECIMEN,Garrya laurifolia,56724,GBIF,,Manuel Vargas,,24.698332999999998,-105.99166699999999,"10 KM ANTES DE OTAEZ, DGO.",1990.0,1,1,1,,WGS84,2019,O. Bravo B.
40064,PRESERVED_SPECIMEN,Garrya laurifolia,56676,GBIF,,Manuel Vargas,,19.555,-101.695,TRES KM AL W DE AROCUTIN Y DOS KM AL SW DE URICHO,1985.0,1,1,1,,WGS84,2019,J. Espinosa G.
40065,PRESERVED_SPECIMEN,Garrya laurifolia,56733,GBIF,,Manuel Vargas,,19.131667,-97.076667,"ESCOLA, BARRANCA DEL RIO JAMAPA, MPIO. CALCAHUALCO",1985.0,1,1,1,,WGS84,2019,J.L. Martínez P.; A. Espíritu S.
40066,PRESERVED_SPECIMEN,Garrya laurifolia,151182,GBIF,,Manuel Vargas,,19.675,-100.275,PRIMERA DE IZAPA,2000.0,1,1,1,,WGS84,2019,M. G. Cornejo T.; et al.
40067,PRESERVED_SPECIMEN,Garrya laurifolia,56661,GBIF,,Manuel Vargas,,21.221667,-99.473333,SEIS KM AL S DE LA PARADA,1990.0,1,1,1,,WGS84,2019,B. Servín
40068,PRESERVED_SPECIMEN,Garrya laurifolia,56673,GBIF,,Manuel Vargas,,19.4,-101.53666700000001,"CERRO LA TAPADA, SAN GREGORIO",1986.0,1,1,1,,WGS84,2019,H. Díaz-Barriga
40069,PRESERVED_SPECIMEN,Garrya laurifolia,56680,GBIF,,Manuel Vargas,,19.781667000000002,-100.658333,"LOS AZUFRES, ZONA GEOTERMICA",1986.0,1,1,1,,WGS84,2019,J. Santos M.
40070,PRESERVED_SPECIMEN,Garrya laurifolia,56654,GBIF,,Manuel Vargas,,21.325,-99.65333299999999,"DIEZ KM DEL PUERTO DE AYUTLA, CAMINO A SANTA MARIA COCOS",1990.0,1,1,1,,WGS84,2019,E. Carranza G.
40071,PRESERVED_SPECIMEN,Garrya laurifolia,56678,GBIF,,Manuel Vargas,,18.691667000000002,-101.56,"LADERA S DEL CERRO PELON, AL N DE LA HACIENDA DE CHARAHUEN",1986.0,1,1,1,,WGS84,2019,J. Espinosa G.
40072,PRESERVED_SPECIMEN,Garrya laurifolia,56710,GBIF,,Manuel Vargas,,19.596667,-103.913333,"34 KM AL NW DE COLIMA, 2 KM AL S DE CERRO GRANDE, MPIO. TOLIMAN, JAL.",1987.0,1,1,1,,WGS84,2019,R. Cuevas G.; M. Rosales
40073,PRESERVED_SPECIMEN,Garrya laurifolia,56744,GBIF,,Manuel Vargas,,16.527222000000002,-92.434722,"JOL CHIK'O TAN, 3 KM AL N DE AMATENANGO DEL VALLE, CHIS.",1988.0,1,1,1,,WGS84,2019,M. Gómez L.
40074,PRESERVED_SPECIMEN,Garrya laurifolia,56657,GBIF,,Manuel Vargas,,21.221667,-99.473333,CINCO KM AL N DE LA PARADA,1990.0,1,1,1,,WGS84,2019,S. Servín
40075,PRESERVED_SPECIMEN,Garrya laurifolia,129096,GBIF,,Manuel Vargas,,19.336667000000002,-102.363333,"27 KM AL W DE URUAPAN EN LINEA RECTA, AL N DEL POBLADO DE TANCITARO, MPIO. TANCITARO",1997.0,1,1,1,,WGS84,2019,I. García; et al.
40076,PRESERVED_SPECIMEN,Garrya laurifolia,56669,GBIF,,Manuel Vargas,,19.595,-101.98,3 KM AL S DE ARANTEPACUA,1990.0,1,1,1,,WGS84,2019,E. García L.; E. Pérez C.
40077,PRESERVED_SPECIMEN,Garrya laurifolia,56732,GBIF,,Manuel Vargas,,20.227778,-103.56944399999999,"CAÑADA DE LA BARRIGONA, MPIO. ZACOALCO DE TORRES, JAL.",1992.0,1,1,1,,WGS84,2019,R. Acevedo R.; et al.
40078,PRESERVED_SPECIMEN,Garrya laurifolia,56708,GBIF,,Manuel Vargas,,19.44782,-103.86109,"LAGUNITAS, EL TERRENO",1991.0,1,1,1,,WGS84,2019,E. Salcedo P.
40079,PRESERVED_SPECIMEN,Garrya laurifolia,56662,GBIF,,Manuel Vargas,,19.895,-101.428333,"CENTRO S DE PEDREGAL PEQUEÑO, 1.5 KM AL SW DE TENDEPARACUA, MPIO. HUANIQUEO, MICH.",1992.0,1,1,1,,WGS84,2019,P. Silva-Sáenz
40080,PRESERVED_SPECIMEN,Garrya laurifolia,56715,GBIF,,Manuel Vargas,,19.79083,-96.815,CUESTA DE LA BARRANCA DEL MAIZ,1988.0,1,1,1,,WGS84,2019,C. Gutiérrez B.
40096,PRESERVED_SPECIMEN,Garrya laurifolia,56689,GBIF,,Manuel Vargas,,21.221667,-99.473333,CUATRO KM AL ORIENTE DE LA PARADA,1990.0,1,1,1,,WGS84,2019,S. Servín
40097,PRESERVED_SPECIMEN,Garrya laurifolia,56684,GBIF,,Manuel Vargas,,21.206389,-99.188056,CINCO KM AL N DE ACATITLAN DE ZARAGOZA,1988.0,1,1,1,,WGS84,2019,E. Carranza G.
40098,PRESERVED_SPECIMEN,Garrya laurifolia,56692,GBIF,,Manuel Vargas,,20.563333,-99.753333,UNO Y MEDIO KM AL NW DEL PUERTO EL SABINITO,1989.0,1,1,1,,WGS84,2019,H. Rubio
40099,PRESERVED_SPECIMEN,Garrya laurifolia,56698,GBIF,,Manuel Vargas,,20.743333,-99.655,SEIS KM AL O DE PUERTO SALITRE,1992.0,1,1,1,,WGS84,2019,V.M. Huerta B.
40100,PRESERVED_SPECIMEN,Garrya laurifolia,56696,GBIF,,Manuel Vargas,,20.915278,-99.564444,"KM 19 CARRETERA SAN JOAQUIN-LA MORA, CERCA DE CASA DE MAQUINAS",1994.0,1,1,1,,WGS84,2019,S. Zamudio R.
40101,PRESERVED_SPECIMEN,Garrya laurifolia,56683,GBIF,,Manuel Vargas,,21.206389,-99.188056,"LAS CUEVITAS, 1 KM AL N DE JACALILLA.",1989.0,1,1,1,,WGS84,2019,E. González P.
40102,PRESERVED_SPECIMEN,Garrya laurifolia,56699,GBIF,,Manuel Vargas,,25.663332999999998,-100.311667,"PARQUE ECOLOGICO CHIPINQUE, MONTERREY, N. L.",1995.0,1,1,1,,WGS84,2019,S. Zamudio R.
40103,PRESERVED_SPECIMEN,Garrya laurifolia,56705,GBIF,,Manuel Vargas,,21.291667,-99.116667,"HOYO DEL LODO, 5 KM AL N DE ACATITLAN DE ZARAGOZA, MPIO. LANDA",1988.0,1,1,1,,WGS84,2019,E. González P.
40104,PRESERVED_SPECIMEN,Garrya laurifolia,56694,GBIF,,Manuel Vargas,,21.195,-99.113333,UNO Y MEDIO KM AL SE DEL RINCON,1990.0,1,1,1,,WGS84,2019,H. Rubio
40105,PRESERVED_SPECIMEN,Garrya laurifolia,56685,GBIF,,Manuel Vargas,,21.326667,-99.203333,CINCO KM AL S DE TRES LAGUNAS,1990.0,1,1,1,,WGS84,2019,E. Carranza G.
40106,PRESERVED_SPECIMEN,Garrya laurifolia,56704,GBIF,,Manuel Vargas,,19.846667,-97.498333,"TEPEICAN, MPIO. TLATLAUQUITEPEC, PUE.",1986.0,1,1,1,,WGS84,2019,F. Ventura A.
40107,PRESERVED_SPECIMEN,Garrya laurifolia,56691,GBIF,,Manuel Vargas,,21.326667,-99.203333,OCHO KM DE LA DESVIACION A TRES LAGUNAS,1988.0,1,1,1,,WGS84,2019,E. Carranza G.
40108,PRESERVED_SPECIMEN,Garrya laurifolia,56687,GBIF,,Manuel Vargas,,21.221667,-99.473333,CUATRO KM AL NE DE LA PARADA,1990.0,1,1,1,,WGS84,2019,B. Servín
40109,PRESERVED_SPECIMEN,Garrya laurifolia,56703,GBIF,,Manuel Vargas,,23.673333,-100.181667,CA. 17.8 MI S OF THE JCT OF HWY 61 TO DOCTOR ARROYO AND THE LINARES-SAN ROBERTO JUNCTION,1981.0,1,1,1,,WGS84,2019,J.M. Poole; et al.
40110,PRESERVED_SPECIMEN,Garrya laurifolia,56701,GBIF,,Manuel Vargas,,20.513333,-98.711667,"PREDIO AL N DE TRES CRUCES, 11 KM AL NE DEL MUNICIPIO DE METZTITLAN, 800 M AGUAS ARRIBA DE LA CARR. FEDERAL ZACUALTIPAN-MOLANGO",1993.0,1,1,1,,WGS84,2019,J.L. López G.
40111,PRESERVED_SPECIMEN,Garrya laurifolia,56706,GBIF,,Manuel Vargas,,20.785,-98.725,"3 KM AL W DE MOLANGO, HGO.",1980.0,1,1,1,,WGS84,2019,G. Pérez S.
40112,PRESERVED_SPECIMEN,Garrya laurifolia,123184,GBIF,,Manuel Vargas,,21.396110999999998,-99.156111,"6-7 KM AL NE DE LA LAGUNITA DE SAN DIEGO, VERTIENTE SE DEL CERRO GRANDE, MPIO. JALPAN, QRO.",1996.0,1,1,1,,WGS84,2019,E. Pérez C.; E. Carranza G.
40113,PRESERVED_SPECIMEN,Garrya laurifolia,56697,GBIF,,Manuel Vargas,,21.39,-100.14,APROX. 1.5 KM AL N DE JOYA FRIA.,1996.0,1,1,1,,WGS84,2019,E. Carranza G.; E. Pérez C.
40114,PRESERVED_SPECIMEN,Garrya laurifolia,56693,GBIF,,Manuel Vargas,,21.268333,-99.245,"DOS KM AL SE DEL AGUACATE, CERCA DE AGUA ZARCA",1989.0,1,1,1,,WGS84,2019,H. Rubio
40115,PRESERVED_SPECIMEN,Garrya laurifolia,56681,GBIF,,Manuel Vargas,,20.563333,-99.753333,UNO Y MEDIO KM AL SE DEL PUERTO EL SABINITO,1989.0,1,1,1,,WGS84,2019,H. Rubio
40116,PRESERVED_SPECIMEN,Garrya laurifolia,56695,GBIF,,Manuel Vargas,,21.206921234386535,-99.19262731754002,DOS KM AL SE DEL RINCON DE SAN JOSE,1990.0,1,1,1,,WGS84,2019,H. Rubio
40117,PRESERVED_SPECIMEN,Garrya laurifolia,56690,GBIF,,Manuel Vargas,,21.273332999999997,-99.268333,"CERRO GRANDE, SIETE KM AL NW DE LAGUNITA DE SAN DIEGO",1990.0,1,1,1,,WGS84,2019,H. Rubio
40118,PRESERVED_SPECIMEN,Garrya laurifolia,56688,GBIF,,Manuel Vargas,,21.221667,-99.473333,CINCO KM AL PONIENTE DE LA PARADA,1990.0,1,1,1,,WGS84,2019,S. Servín
40119,PRESERVED_SPECIMEN,Garrya laurifolia,56700,GBIF,,Manuel Vargas,,24.868333,-100.231667,MPIO. GALEANA,1970.0,1,1,1,,WGS84,2019,G. Hinton; et al.
40120,PRESERVED_SPECIMEN,Garrya laurifolia,56686,GBIF,,Manuel Vargas,,21.314167,-99.833333,"EL PINALITO, POR CARRICILLO",1991.0,1,1,1,,WGS84,2019,E. Ventura V.; E. López
40179,PRESERVED_SPECIMEN,Garrya laurifolia,154211,GBIF,,Manuel Vargas,,17.545,-99.893333,"± 1 KM AL SW DE CRUZ DE OCOTE, MPIO. CHICHIHUALCO, GRO.",1985.0,1,1,1,,WGS84,2019,F. Lorea
40180,PRESERVED_SPECIMEN,Garrya laurifolia,138434,GBIF,,Manuel Vargas,,21.14525,-99.57533000000001,"CAÑADA DEL AGUA FRIA, MPIO. PINAL DE AMOLES",1990.0,1,1,1,,WGS84,2019,S. Zamudio R.; E. Pérez C.
40181,PRESERVED_SPECIMEN,Garrya laurifolia,123197,GBIF,,Manuel Vargas,,17.657778,-99.676389,"1 KM AL SW DE CRUZ DE OCOTE, MPIO. LEONARDO BRAVO, GRO.",1985.0,1,1,1,,WGS84,2019,NO DISPONIBLE
40182,PRESERVED_SPECIMEN,Garrya laurifolia,164380,GBIF,,Manuel Vargas,,20.41639,-103.39111,"ARROYO DEL AGUA CERRO VIEJO, CUYUTLAN, JAL.",1976.0,1,1,1,,WGS84,2019,C. L. Díaz-Luna
40183,PRESERVED_SPECIMEN,Garrya laurifolia,125721,GBIF,,Manuel Vargas,,17.651667,-99.84,"1 KM DESV. ATOYAC, CARR. CHILPANCINGO-FILO DE CABALLOS",1980.0,1,1,1,,WGS84,2019,V.M. Calzada
40184,PRESERVED_SPECIMEN,Garrya laurifolia,123266,GBIF,,Manuel Vargas,,21.501667,-100.440278,"8 KM AL NW DE MESAS DE JESUS, POR EL CAMINO A SAN ANTON, MPIO. SAN LUIS DE LA PAZ, GTO.",1996.0,1,1,1,,WGS84,2019,E. Carranza G.; E. Pérez C.
40185,PRESERVED_SPECIMEN,Garrya laurifolia,123196,GBIF,,Manuel Vargas,,17.657778,-99.676389,"1 KM AL SW DE CRUZ DE OCOTE, MPIO. LEONARDO BRAVO, GRO.",1985.0,1,1,1,,WGS84,2019,F. Lorea
40186,PRESERVED_SPECIMEN,Garrya laurifolia,150953,GBIF,,Manuel Vargas,,22.644233,-100.426833,MPIO. TRINITARIA,2001.0,1,1,1,,WGS84,2019,S. Zamudio R.
40275,UNKNOWN,Garrya laurifolia,NO DISPONIBLE,GBIF,,Manuel Vargas,,19.416110999999997,-102.128333,Nuevo San Juan Parangaricutiro,,1,1,1,,WGS84,2019,NO DISPONIBLE
40276,PRESERVED_SPECIMEN,Garrya laurifolia,403646,GBIF,,Manuel Vargas,,17.543611,-99.90083299999999,"Cruz de Ocote, 1 km al SO",1983.0,1,1,1,,WGS84,2019,Esteban Martínez Salas; F. R. Barrie
40277,PRESERVED_SPECIMEN,Garrya laurifolia,059485,GBIF,,Manuel Vargas,,18.525833,-99.743889,"El Ancón, 1.5 km al SE, camino a Ixcateopan",1998.0,1,1,1,,WGS84,2019,Ramiro Cruz Durán
40278,PRESERVED_SPECIMEN,Garrya laurifolia,059486,GBIF,,Manuel Vargas,,18.525,-99.718333,"San Miguel, 4 km al N, camino a Taxco",1998.0,1,1,1,,WGS84,2019,Ramiro Cruz Durán
40279,PRESERVED_SPECIMEN,Garrya laurifolia,061316,GBIF,,Manuel Vargas,,18.635832999999998,-99.7875,Cruz Alta rumbo a Puerto Obscuro,1998.0,1,1,1,,WGS84,2019,Jorge Calónico Soto
40280,PRESERVED_SPECIMEN,Garrya laurifolia,408964,GBIF,,Manuel Vargas,,17.541667,-99.912778,"Cruz de Ocote, 2 km al SO",1983.0,1,1,1,,WGS84,2019,Esteban Martínez Salas; José Carmen Soto Núñez; Guillermo Silva R.
40281,PRESERVED_SPECIMEN,Garrya laurifolia,060083,GBIF,,Manuel Vargas,,18.5875,-99.6625,"Taxco, 8 km al NO, rumbo a Puerto Obscuro",1997.0,1,1,1,,WGS84,2019,Jorge Calónico Soto
40282,PRESERVED_SPECIMEN,Garrya laurifolia,060368,GBIF,,Manuel Vargas,,18.622778,-99.778889,"Taxco, 19.4 km al NO",1998.0,1,1,1,,WGS84,2019,Ramiro Cruz Durán
40346,PRESERVED_SPECIMEN,Garrya laurifolia,078916,GBIF,,Manuel Vargas,,17.696306,-99.874111,"Corralitos, 2.1 km al NO, camino a Tlacotepec",2000.0,1,1,1,,WGS84,2019,Ramiro Cruz Durán
40347,HUMAN_OBSERVATION,Garrya laurifolia,NO DISPONIBLE,GBIF,,Manuel Vargas,,17.906397,-96.924083,Falda del Ocote de San Juan Coyula,2007.0,1,1,1,,WGS84,2019,Rufina García
40348,HUMAN_OBSERVATION,Garrya laurifolia,NO DISPONIBLE,GBIF,,Manuel Vargas,,17.906397,-96.924083,Falda del Ocote de San Juan Coyula,2007.0,1,1,1,,WGS84,2019,Rufina García
40351,PRESERVED_SPECIMEN,Garrya laurifolia,00419341,GBIF,,Manuel Vargas,,18.127833,-96.95647199999999,"Aproximadamente 4 km del Plan de Guadalupe, por la terracería a San Martín Zoquiapan",2002.0,1,1,1,,WGS84,2019,D.X. Munn-Estrada; M. Arakaki; J.L. Panero; B. Crozier; F. Mendoza
40352,PRESERVED_SPECIMEN,Garrya laurifolia,00419339,GBIF,,Manuel Vargas,,18.145944,-96.83425,"Aproximadamente 800 m de Sta. Cruz de Juárez, por la brecha a Huautla de Jiménez",2002.0,1,1,1,,WGS84,2019,D.X. Munn-Estrada; F. Mendoza
40353,PRESERVED_SPECIMEN,Garrya laurifolia,00419340,GBIF,,Manuel Vargas,,18.127833,-96.95647199999999,"Aproximadamente 4 km del Plan de Guadalupe, por la terracería a San Martín Zoquiapan",2002.0,1,1,1,,WGS84,2019,D.X. Munn-Estrada; M. Arakaki; J.L. Panero; B. Crozier; F. Mendoza
40361,PRESERVED_SPECIMEN,Garrya laurifolia,1769,GBIF,,Manuel Vargas,,19.525,-104.225,8-9 km al NE de El Durazno,1987.0,1,1,1,,WGS84,2019,Ramón Cuevas Guzmán
40362,PRESERVED_SPECIMEN,Garrya laurifolia,12082,GBIF,,Manuel Vargas,,19.437778,-103.944722,"2 km al NO de El Terrero, 11-12 km al NE de Minatitlán",1992.0,1,1,1,,WGS84,2019,Francisco Javier Santana Michel
40363,PRESERVED_SPECIMEN,Garrya laurifolia,18187,GBIF,,Manuel Vargas,,19.449167000000003,-103.95,"3 km al NO del aserradero, 16 km al N carretera Colima - Minatitlán",1990.0,1,1,1,,WGS84,2019,Enrique José Jardel Peláez; Elizabeth Muñoz Mendoza; Ana Luisa Santiago Pérez
40364,PRESERVED_SPECIMEN,Garrya laurifolia,2058,GBIF,,Manuel Vargas,,19.591667,-104.291667,"Camino a Corralitos, 10 km al SSE de Ahuacapán",1984.0,1,1,1,,WGS84,2019,Theodore Cochrane; Emmet Judziewicz
40365,PRESERVED_SPECIMEN,Garrya laurifolia,18172,GBIF,,Manuel Vargas,,19.536111,-103.970833,3 km al N de El Terrero,1991.0,1,1,1,,WGS84,2019,Enrique José Jardel Peláez; Elizabeth Muñoz Mendoza; Ana Luisa Santiago Pérez
40366,PRESERVED_SPECIMEN,Garrya laurifolia,10473,GBIF,,Manuel Vargas,,19.465833,-103.94888900000001,"3 km al O de El Terrero, 10-11 km al NE de Minatitlán",1990.0,1,1,1,,WGS84,2019,Ramón Cuevas Guzmán; Luis Guzmán Hernández
40367,PRESERVED_SPECIMEN,Garrya laurifolia,7833,GBIF,,Manuel Vargas,,19.462222,-103.929167,"2-3 km al NE de El Terrero, 15-16 km al NE de Minatitlán",1988.0,1,1,1,,WGS84,2019,Luis Guzmán Hernández
40368,PRESERVED_SPECIMEN,Garrya laurifolia,1611,GBIF,,Manuel Vargas,,19.641667,-104.30833299999999,5-6 km al NE de Corralitos,1987.0,1,1,1,,WGS84,2019,José Antonio Vázquez García
40369,PRESERVED_SPECIMEN,Garrya laurifolia,3419,GBIF,,Manuel Vargas,,19.472222,-103.958333,"2 km al S de Cerro Grande, 34 km al NO de Colima",1987.0,1,1,1,,WGS84,2019,Ramón Cuevas Guzmán
40370,PRESERVED_SPECIMEN,Garrya laurifolia,22498,GBIF,,Manuel Vargas,,19.677222,-100.281389,"Sierra Chincua, Reserva de la Biósfera Mariposa Monarca.",2001.0,1,1,1,,WGS84,2019,Ma. Guadalupe Cornejo T.; Guillermo Ibarra Manríquez
40371,PRESERVED_SPECIMEN,Garrya laurifolia,6726,GBIF,,Manuel Vargas,,19.4875,-103.964722,"10.6 km al N de El Terrero, 35.5 km al NO de Colima",1989.0,1,1,1,,WGS84,2019,Mark Wetter; Theodore Cochrane; Ramón Cuevas Guzmán
40372,PRESERVED_SPECIMEN,Garrya laurifolia,10367,GBIF,,Manuel Vargas,,19.444444,-103.93333299999999,"1 Km al E de El Terrero, 13-14 km al ENE de Minatitlán, 31 km al NO de Colima",1987.0,1,1,1,,WGS84,2019,Hugh Iltis; Bruce Benz; Rafael Guzmán Mejía
40373,PRESERVED_SPECIMEN,Garrya laurifolia,1537,GBIF,,Manuel Vargas,,19.541667,-103.975,2 km al SE de La Laguna,1987.0,1,1,1,,WGS84,2019,Ramón Cuevas Guzmán
40374,PRESERVED_SPECIMEN,Garrya laurifolia,388,GBIF,,Manuel Vargas,,19.441667000000002,-103.975,4 km al E de El Terrero,1987.0,1,1,1,,WGS84,2019,Ramón Cuevas Guzmán
40375,PRESERVED_SPECIMEN,Garrya laurifolia,4951,GBIF,,Manuel Vargas,,19.482778,-103.932222,"1 km al O de Los Picachos, 31.6 km al NO de Colima",1988.0,1,1,1,,WGS84,2019,Ramón Cuevas Guzmán
40376,PRESERVED_SPECIMEN,Garrya laurifolia,12379,GBIF,,Manuel Vargas,,19.449167000000003,-103.95,"2 km al NO de El Terrero, 11-12 km al NE de Minatitlán",1993.0,1,1,1,,WGS84,2019,Elizabeth Muñoz Mendoza; José Martín Vázquez López
40377,PRESERVED_SPECIMEN,Garrya laurifolia,18152,GBIF,,Manuel Vargas,,19.580556,-104.26527800000001,"1.5 km al E de La Estación Científica Las Joyas, 2 km al NE del Cerro El Almeal, entre San Campús y Puerto El Escobedo",1991.0,1,1,1,,WGS84,2019,Enrique José Jardel Peláez; Elizabeth Muñoz Mendoza; Ana Luisa Santiago Pérez
40378,PRESERVED_SPECIMEN,Garrya laurifolia,5222,GBIF,,Manuel Vargas,,19.46,-103.958333,"1-2 km al N de El Terrero, 32-33 km al NO de Colima",1988.0,1,1,1,,WGS84,2019,Ramón Cuevas Guzmán
40379,PRESERVED_SPECIMEN,Garrya laurifolia,10558,GBIF,,Manuel Vargas,,19.470278,-103.934444,2 km al E de El Terrero,1991.0,1,1,1,,WGS84,2019,Judith Cevallos Espinosa; Francisco Javier Santana Michel
40380,PRESERVED_SPECIMEN,Garrya laurifolia,1479,GBIF,,Manuel Vargas,,19.458333,-103.94166700000001,0.5-1 km al S de Cerro Grande,1987.0,1,1,1,,WGS84,2019,Ramón Cuevas Guzmán
40381,PRESERVED_SPECIMEN,Garrya laurifolia,4937,GBIF,,Manuel Vargas,,19.5325,-103.966667,"2-3 km al SSE de La Laguna, 40.5 km al NO de Colima",1988.0,1,1,1,,WGS84,2019,Ramón Cuevas Guzmán
40382,PRESERVED_SPECIMEN,Garrya laurifolia,13504,GBIF,,Manuel Vargas,,19.580556,-104.26527800000001,"1.5 km al E de La Estación Científica Las Joyas, 2 km al NE del Cerro El Almeal, entre San Campús y Puerto El Escobedo",1990.0,1,1,1,,WGS84,2019,Enrique José Jardel Peláez; Elizabeth Muñoz Mendoza; Ana Luisa Santiago Pérez
40605,PRESERVED_SPECIMEN,Garrya laurifolia,143622,GBIF,15884,Manuel Vargas,,20.78387254413839,-103.83355207632616,"Volcan Tequila, along road to microwave station, oak forest interspersed with pines to 9000 ft (pines alone reaching top of plug at 9800 ft).",1970.0,1,1,1,,WGS84,2019,Grady L. Webster
40607,PRESERVED_SPECIMEN,Garrya laurifolia,145428,GBIF,12847,Manuel Vargas,,14.493651256444686,-90.71794029653492,Slopes N of Volcán Agua near Km 7 on road from Antigua to Santa María de Jesús. Oak-juniper woods.,1962.0,1,1,1,,WGS84,2019,Grady L. Webster
40608,PRESERVED_SPECIMEN,Garrya laurifolia,145429,GBIF,12945,Manuel Vargas,,16.260789522545405,-92.15992891707904,"On limestone hills 3 miles NW of Comitan. Woods of Acacia, Quercus, Garrya, Junipers et al.",1962.0,1,1,1,,WGS84,2019,Grady L. Webster
40734,HUMAN_OBSERVATION,Garrya laurifolia,20372592,GBIF,,Manuel Vargas,,9.563299,-83.754954,,2016.0,1,1,1,,WGS84,2019,Nate Hartley
40735,HUMAN_OBSERVATION,Garrya laurifolia,21293683,GBIF,,Manuel Vargas,,16.71309,-92.610523,,2019.0,1,1,1,,WGS84,2019,Neptalí Ramírez Marcial
40740,HUMAN_OBSERVATION,Garrya laurifolia,3218999,GBIF,,Manuel Vargas,,9.659801,-83.876919,,2016.0,1,1,1,,WGS84,2019,Lena Struwe
44228,PRESERVED_SPECIMEN,Garrya laurifolia,CIB 2927,GBIF,,Manuel Vargas,,19.675,-98.208333,La Peña del Rosario (C. El Peñón).,1989.0,1,1,1,,WGS84,2019,R. Acosta P.; M. Sánchez F.
44237,PRESERVED_SPECIMEN,Garrya laurifolia,CIB 12708,GBIF,,Manuel Vargas,,19.558332999999998,-97.108333,Cascada del alto Pixquiac.,1982.0,1,1,1,,WGS84,2019,M. J. Cházaro B.
44242,PRESERVED_SPECIMEN,Garrya laurifolia,CIB 12709,GBIF,,Manuel Vargas,,16.741667,-92.608333,"Rancho nuevo, km 7 carretera San Cristóbal Comitán el Corralito.",1980.0,1,1,1,,WGS84,2019,J. G. García F.; J. I. Calzada; A. P. Vovides
44253,PRESERVED_SPECIMEN,Garrya laurifolia,139416,GBIF,,Manuel Vargas,,18.648278,-99.784253,"A 3 km de la desviación a Mamatla, yendo por Taxco.",2013.0,1,1,1,,WGS84,2019,RGJ; MGM; FMI; GVD
44256,PRESERVED_SPECIMEN,Garrya laurifolia,139417,GBIF,,Manuel Vargas,,18.637860999999997,-99.767833,A 2.8 km desde Mamatla hacia Puerto Oscuro.,2013.0,1,1,1,,WGS84,2019,RGJ; MGM; FMI; GVD
44310,PRESERVED_SPECIMEN,Garrya laurifolia,HEM 645,GBIF,,Manuel Vargas,,16.7275,-92.25444399999999,Rancho El Cura.,1995.0,1,1,1,,WGS84,2019,M.M.I.; L.D.L.R.; H.C.O.; C.S.R.
44329,PRESERVED_SPECIMEN,Garrya laurifolia,HEM 644,GBIF,,Manuel Vargas,,16.701389000000002,-92.60972199999999,Rancho Merced-Bazom.,1989.0,1,1,1,,WGS84,2019,M.G.E.; P.F.Q.A.; M.M.I.; N.R.M.
44336,PRESERVED_SPECIMEN,Garrya laurifolia,HEM 11310,GBIF,,Manuel Vargas,,16.778889000000003,-92.651944,"Barrio La Fortuna, La Milpoleta.",1995.0,1,1,1,,WGS84,2019,N.R.M.; M.J.D.G.
44353,PRESERVED_SPECIMEN,Garrya laurifolia,36444,GBIF,,Manuel Vargas,,21.14,-99.68333299999999,"Cañada del Agua Fría, cerro La Calentura, mpio. Pinal de Amoles.",1988.0,1,1,1,,WGS84,2019,S. Zamudio R.
44361,PRESERVED_SPECIMEN,Garrya laurifolia,44200,GBIF,,Manuel Vargas,,16.684167000000002,-97.06916700000001,"Paraje El Nebro, 10 km al S de La Cofradía y 4 km de Tierra Blanca, comunidad de San Pedro El Alto, mpio. Zimatlán de Alvarez.",1998.0,1,1,1,,WGS84,2019,A.G. Miranda M.; O.L. Hernández M.
44365,PRESERVED_SPECIMEN,Garrya laurifolia,36461,GBIF,,Manuel Vargas,,21.464389,-99.17251999999999,"5-6 km al S de La Parada, Las Guacamayas, mpio. Jalpan de Serra.",1990.0,1,1,1,,WGS84,2019,B. Servín
44366,PRESERVED_SPECIMEN,Garrya laurifolia,38283,GBIF,,Manuel Vargas,,21.338984,-99.617432,"Puerto de Ayutla, a 9-10 km por el camino a Santa María Cocos, mpio. Arroyo Seco.",1990.0,1,1,1,,WGS84,2019,E. Carranza G.
44369,PRESERVED_SPECIMEN,Garrya laurifolia,24969,GBIF,,Manuel Vargas,,25.050832999999997,-105.995278,"Puente El Cajón de San Antonio a 10 km de Altares, camino Santiago Papasquiaro-Cuevecillas, mpio. Santiago Papasquiaro.",1990.0,1,1,1,,WGS84,2019,O. Bravo B.
44371,PRESERVED_SPECIMEN,Garrya laurifolia,20967,GBIF,,Manuel Vargas,,19.445833,-98.779167,"13-14 km al E de Tequesquináhuac, por la brecha que va al cerro Tláloc, mpio. Texcoco.",1986.0,1,1,1,,WGS84,2019,F. Zavala Ch.
44372,PRESERVED_SPECIMEN,Garrya laurifolia,33174,GBIF,,Manuel Vargas,,24.905278,-105.140833,"Arroyo Los Alisos, ejido San Diego de Tenzaens, mpio. Santiago Papasquiaro.",1993.0,1,1,1,,WGS84,2019,M.S. González E.; M. González
44381,PRESERVED_SPECIMEN,Garrya laurifolia,11912,GBIF,,Manuel Vargas,,19.485,-98.772222,"Proximidades a Santa Catarina del Monte, mpio. Texcoco.",1983.0,1,1,1,,WGS84,2019,E. Ventura V.
44384,PRESERVED_SPECIMEN,Garrya laurifolia,6208,GBIF,,Manuel Vargas,,17.550832999999997,-96.507222,"Brecha 300; terrenos forestales de la Comunidad de San Pablo Macuiltianguis, mpio. San Pablo Macuiltianguis.",1980.0,1,1,1,,WGS84,2019,E. Guízar N.
44391,PRESERVED_SPECIMEN,Garrya laurifolia,30219,GBIF,,Manuel Vargas,,24.729722,-105.968056,"10 km antes de Otaez, mpio. Otaez.",1990.0,1,1,1,,WGS84,2019,O. Bravo B.
44393,PRESERVED_SPECIMEN,Garrya laurifolia,37935,GBIF,,Manuel Vargas,,20.518056,-98.715278,"En el predio al N tres cruces a 11 km al NE de la Población de Metztitlán; a 800 m aguas arriba en relación a la carr. fed. Zacualtipán-Molango, mpio. Metztitlán.",1992.0,1,1,1,,WGS84,2019,J.L. López G.
44394,PRESERVED_SPECIMEN,Garrya laurifolia,29527,GBIF,,Manuel Vargas,,25.120832999999998,-106.525,"Cuevecillas, mpio. Canelas.",1990.0,1,1,1,,WGS84,2019,O. Bravo B.
44395,PRESERVED_SPECIMEN,Garrya laurifolia,35853,GBIF,,Manuel Vargas,,20.640556,-98.575278,"Paraje Cumbre de Tlahuelompa, 2 km al SW de Tlahuelompa, 7 km del entronque de la carretera federal Zacualtipán-Metzquititlán, mpio. Zacualtipán de Ángeles.",1992.0,1,1,1,,WGS84,2019,J.L. López G.
44400,PRESERVED_SPECIMEN,Garrya laurifolia,16649,GBIF,,Manuel Vargas,,24.888333,-100.21333299999999,Cerro El Potosí.,1970.0,1,1,1,,WGS84,2019,J. Rzedowski R.; G.B. Hinton
44403,PRESERVED_SPECIMEN,Garrya laurifolia,24880,GBIF,,Manuel Vargas,,25.236389000000003,-106.549444,6 km de Topia rumbo a Torance.,1990.0,1,1,1,,WGS84,2019,O. Bravo B.
44410,PRESERVED_SPECIMEN,Garrya laurifolia,46806,GBIF,,Manuel Vargas,,23.444444,-104.171111,"Rancho La Cebolla, 1 km de La Laguna, mpio. Súchil.",1985.0,1,1,1,,WGS84,2019,M.S. González E.
44416,PRESERVED_SPECIMEN,Garrya laurifolia,14925,GBIF,,Manuel Vargas,,19.623889000000002,-101.583889,"Cerro Tariaqueri, mpio. Tzintzuntzan.",1985.0,1,1,1,,WGS84,2019,H. Díaz B.
44420,PRESERVED_SPECIMEN,Garrya laurifolia,45864,GBIF,,Manuel Vargas,,21.391667,-100.141667,"La Joya Fría, mpio. Victoria.",1996.0,1,1,1,,WGS84,2019,E. Carranza G.; E. Pérez C.
44421,PRESERVED_SPECIMEN,Garrya laurifolia,47221,GBIF,,Manuel Vargas,,20.147222,-98.662778,"Barrio de Escobar, aledaño a la Ex-Mina de Morán, mpio. Mineral del Monte.",1998.0,1,1,1,,WGS84,2019,H. García M.
44427,PRESERVED_SPECIMEN,Garrya laurifolia,5250,GBIF,,Manuel Vargas,,19.473333,-98.776667,"Al NW de San Pablo Ixayoc, mpio. Texcoco.",1980.0,1,1,1,,WGS84,2019,G. Flores E.
44434,PRESERVED_SPECIMEN,Garrya laurifolia,24873,GBIF,,Manuel Vargas,,25.1475,-106.400833,"1 km de Cuevecillas hacia los Altares, mpio. Canelas.",1990.0,1,1,1,,WGS84,2019,O. Bravo B.
44439,PRESERVED_SPECIMEN,Garrya laurifolia,20112,GBIF,,Manuel Vargas,,19.810278,-100.619444,"Alrededores del Pozo Az-16, Campo Geotérmico Los Azufres, mpio. Zinapécuaro.",1986.0,1,1,1,,WGS84,2019,J. Santos M.
44442,PRESERVED_SPECIMEN,Garrya laurifolia,15000,GBIF,,Manuel Vargas,,19.513056,-101.54,"Cerro Los Lobos, 5 km al SE de Pátzcuaro, mpio. Pátzcuaro.",1986.0,1,1,1,,WGS84,2019,H. Díaz B.
44446,PRESERVED_SPECIMEN,Garrya laurifolia,32598,GBIF,,Manuel Vargas,,21.125,-104.508333,"Volcán Ceboruco, junto a la estación de microondas, mpio. Ahuacatlán.",1986.0,1,1,1,,WGS84,2019,S. Zamudio R.
