,BasisOfRec,Binomial,CatalogNo,Citation,CollectID,Compiler,Data_sens,Dec_Lat,Dec_Long,Dist_comm,Event_Year,Origin,Presence,Seasonal,Sens_comm,SpatialRef,YrCompiled,recordedBy
47416,PRESERVED_SPECIMEN,Guarea rhopalocarpa,1389510,GBIF,Folsom 6528,Manuel Vargas,,8.68055,-80.60833000000001,"Area surrounding Rivera Sawmill, Alto Calvario; 7 km N of El Copé; continental divide; wet cloud forest; the New Works near trout stream.",1977.0,1,1,1,,WGS84,2019,James P. Folsom|Leo Collins
47417,PRESERVED_SPECIMEN,Guarea rhopalocarpa,1389579,GBIF,Burger 9825,Manuel Vargas,,10.75,-85.05,Remnant evergreen forest and secondary growth in the tropical-premontane wet forest transition zone about 3 km NNE of Bijagua along the new road to Upala,1975.0,1,1,1,,WGS84,2019,William C. Burger|Richard A. Baker
47833,PRESERVED_SPECIMEN,Guarea rhopalocarpa,1471608,GBIF,Neill 3610,Manuel Vargas,,11.133333,-84.2,"Near Caño Chontaleño, 20 km NE of El Castillo.",1978.0,1,1,1,,WGS84,2019,David A. Neill|Paul C. Vincelli
47840,PRESERVED_SPECIMEN,Guarea rhopalocarpa,1471852,GBIF,Gentry 28693,Manuel Vargas,,7.725,-77.741667,"Alto de Nique, southernmost peak of Pirre Massif, exactly on the Panama/Colombia (Chocó) border.",1980.0,1,1,1,,WGS84,2019,Alwyn H. Gentry|Enrique  Forero|Michael O. Dillon|Enrique  Rentería A.|Laurence E. Skog|Mario Sousa S.|David B. Lellinger
49818,PRESERVED_SPECIMEN,Guarea rhopalocarpa,1988134,GBIF,Smith F1750,Manuel Vargas,,10.30611,-84.42694,Villa Quesada,1939.0,1,1,1,,WGS84,2019,Austin Smith
49824,PRESERVED_SPECIMEN,Guarea rhopalocarpa,1988499,GBIF,Folsom 5686,Manuel Vargas,,8.681944999999999,-80.601389,"Around Rivera Sawmill, 7 km north of El Copé, road to summit.",1977.0,1,1,1,,WGS84,2019,James P. Folsom|Robert L. Dressler|Kerry Dressler|C. Meyers|J. Daley|A. Jaslow
49828,PRESERVED_SPECIMEN,Guarea rhopalocarpa,1988550,GBIF,Burger 4460,Manuel Vargas,,8.78333,-82.96666,Forested slopes east of Las Cruces and 5 to 6 km south of San Vito on and around the property of Mr. Robt. Wilson.,1967.0,1,1,1,,WGS84,2019,William C. Burger|G. Mata U.
49832,PRESERVED_SPECIMEN,Guarea rhopalocarpa,1988425,GBIF,Nee 11156,Manuel Vargas,,8.523889,-81.12944399999999,7 km W of Santa Fé on new road past agricultural school.,1974.0,1,1,1,,WGS84,2019,Michael H. Nee
49834,PRESERVED_SPECIMEN,Guarea rhopalocarpa,1989035,GBIF,Mori 6180,Manuel Vargas,,8.539719999999999,-81.15722,NW of Santa Fé. 8.8 km from Escuela Agricola Alto de Piedra. Pacific slope. Hillside above stream,1975.0,1,1,1,,WGS84,2019,Scott A. Mori|Jacquelyn A. Kallunki
49837,PRESERVED_SPECIMEN,Guarea rhopalocarpa,1988698,GBIF,Sytsma 4716,Manuel Vargas,,8.510833,-81.125556,Cerro Tute; E slopes; 1 km beyond Escuela Agricola Alto Piedra above Santa Fé.,1981.0,1,1,1,,WGS84,2019,Kenneth J. Sytsma|Lennart Andersson
49841,PRESERVED_SPECIMEN,Guarea rhopalocarpa,1989181,GBIF,Nee 9808,Manuel Vargas,,8.516667,-81.11805600000001,6-7 km west of Santa Fé on new road past agriculture school.,1974.0,1,1,1,,WGS84,2019,Michael H. Nee
49847,PRESERVED_SPECIMEN,Guarea rhopalocarpa,1989323,GBIF,Sytsma 4553,Manuel Vargas,,8.67666,-80.61,"Above El Potroso sawmill at Continental Divide, N of El Cope. Low cloud forest",1981.0,1,1,1,,WGS84,2019,Kenneth J. Sytsma|Lennart Andersson
49853,PRESERVED_SPECIMEN,Guarea rhopalocarpa,1989026,GBIF,Pennington 11519,Manuel Vargas,,10.16,-83.93,"Parque Nacional Braulio Carillo, forest on steep slopes above Río Sucio, ravine bottom, Loc: NW1083",1984.0,1,1,1,,WGS84,2019,T. D. Pennington|Pablo E. Sánchez V.|Nelson Zamora
49859,PRESERVED_SPECIMEN,Guarea rhopalocarpa,1989866,GBIF,Jiménez Madrigal 599,Manuel Vargas,,10.25,-84.25138000000001,"Bajos del Toro, Sarchí",1988.0,1,1,1,,WGS84,2019,Quírico Jiménez|Luis H. Elizondo|R. Hernández
49861,PRESERVED_SPECIMEN,Guarea rhopalocarpa,1990079,GBIF,Utley 2822,Manuel Vargas,,10.27,-84.16,Vicinity of Colonia Virgen del Socorro,1975.0,1,1,1,,WGS84,2019,John F. Utley|K. Burt-Utley
49865,PRESERVED_SPECIMEN,Guarea rhopalocarpa,1989614,GBIF,Folsom 3186,Manuel Vargas,,8.683333,-80.6,"New Works at Rivera sawmill, Alto Calvario.",1977.0,1,1,1,,WGS84,2019,James P. Folsom
49866,PRESERVED_SPECIMEN,Guarea rhopalocarpa,1990219,GBIF,Gómez Pignataro 20846,Manuel Vargas,,10.05,-84.01,"Parque Nacional Braulio Carrillo, Estación La Montura, Sendero A de 0-250 m, bosque pluvial premontano",1984.0,1,1,1,,WGS84,2019,Luis Diego Gómez P.|Isidro A. Chacón G.|Gerardo Herrera Ch.
49869,PRESERVED_SPECIMEN,Guarea rhopalocarpa,1990096,GBIF,Folsom 6464,Manuel Vargas,,8.677778,-80.60972199999999,"Area surrounding Rivera Sawmill, Alto Calvario; 7 km north of El Cope; continental divide.",1977.0,1,1,1,,WGS84,2019,James P. Folsom|Leo Collins
49871,PRESERVED_SPECIMEN,Guarea rhopalocarpa,1989801,GBIF,Croat 27644,Manuel Vargas,,8.550833,-81.171389,"Valley of Río Dos Bocas along road between Escuela Agricola Alto Piedra and Calovebora, 15.6 km northwest of Santa Fé; along trail to Santa Fé, steep forested hill east of river.",1974.0,1,1,1,,WGS84,2019,Thomas B. Croat
49872,PRESERVED_SPECIMEN,Guarea rhopalocarpa,1990145,GBIF,Pennington 11475,Manuel Vargas,,10.08,-83.49,Hills east of Siquirres.  Pasture and forest remnants,1984.0,1,1,1,,WGS84,2019,T. D. Pennington|Luis J. Poveda Álvarez
49877,PRESERVED_SPECIMEN,Guarea rhopalocarpa,1990850,GBIF,Burger 4524,Manuel Vargas,,8.83333,-82.91666,Forest remnant on slopes northeast of Sabalito along road to La Union. In forest.,1967.0,1,1,1,,WGS84,2019,William C. Burger|G. Mata U.
49882,PRESERVED_SPECIMEN,Guarea rhopalocarpa,1990508,GBIF,Frankie 4a,Manuel Vargas,,10.43138,-84.00361,"Finca la Selva, Puerto Viejo. In cacao plantation.",1968.0,1,1,1,,WGS84,2019,G. W. Frankie
49885,PRESERVED_SPECIMEN,Guarea rhopalocarpa,1990778,GBIF,Bawa 507,Manuel Vargas,,10.42,-84.02,"Finca La Selva, wet evergreen forest",1970.0,1,1,1,,WGS84,2019,K. S. Bawa
49890,PRESERVED_SPECIMEN,Guarea rhopalocarpa,1991348,GBIF,Lent 2142,Manuel Vargas,,10.39,-84.1,"Primary forest, Istarú Farm, Tirimbina, Sarapiquí",1971.0,1,1,1,,WGS84,2019,Roy W. Lent
49896,PRESERVED_SPECIMEN,Guarea rhopalocarpa,1990793,GBIF,Mori 4975,Manuel Vargas,,9.284167,-79.308611,5-10 km NE of Altos de Pacora. On trail at end of road.,1975.0,1,1,1,,WGS84,2019,Scott A. Mori|Jacquelyn A. Kallunki
49897,PRESERVED_SPECIMEN,Guarea rhopalocarpa,1990794,GBIF,Mori 4875,Manuel Vargas,,9.284167,-79.308611,5-10 km NE of Altos de Pacora. On trail at end of road.,1975.0,1,1,1,,WGS84,2019,Scott A. Mori|Jacquelyn A. Kallunki
49900,PRESERVED_SPECIMEN,Guarea rhopalocarpa,1991103,GBIF,Frankie 4e,Manuel Vargas,,10.43138,-84.00361,"Finca la Selva, Puerto Viejo. In old cacao plantation.",1968.0,1,1,1,,WGS84,2019,G. W. Frankie
49904,PRESERVED_SPECIMEN,Guarea rhopalocarpa,1991241,GBIF,Hammel 2631,Manuel Vargas,,8.668333,-80.595,Along road from La Pindeda to El Copé by way of Piedras Gordas. Sawmill above el Copé.,1978.0,1,1,1,,WGS84,2019,Barry E. Hammel
49905,PRESERVED_SPECIMEN,Guarea rhopalocarpa,1991422,GBIF,Neill 5116,Manuel Vargas,,10.407222,-84.0,"La Selva Biological Station, Puerto Viejo de Sarapiqui. Tropical Wet Forest.",1981.0,1,1,1,,WGS84,2019,David A. Neill
50227,PRESERVED_SPECIMEN,Guarea rhopalocarpa,2041862,GBIF,Hammel 11225,Manuel Vargas,,10.43138,-84.00361,"Finca La Selva, the OTS field station on the Río Puerto Viejo just E of its junction with the Río Sarapiquí.",1982.0,1,1,1,,WGS84,2019,Barry E. Hammel
50519,PRESERVED_SPECIMEN,Guarea rhopalocarpa,2075841,GBIF,Hammel 9845,Manuel Vargas,,10.43138,-84.00361,"Finca La Selva, the OTS field station on the Río Puerto Viejo just E of its junction with the Río Sarapiquí.",1980.0,1,1,1,,WGS84,2019,Barry E. Hammel
50952,PRESERVED_SPECIMEN,Guarea rhopalocarpa,2150765,GBIF,Gómez Pignataro 22766,Manuel Vargas,,10.15,-83.94,"Sucio River [Río Sucio]. Trail beyond Río Sucio, [Parque Nacional] Braulio Carrillo.",1984.0,1,1,1,,WGS84,2019,Luis Diego Gómez P.|Isidro A. Chacón G.|Gerardo Herrera Ch.
54930,UNKNOWN,Guarea rhopalocarpa,100082981,GBIF,,Manuel Vargas,,8.68333,-83.2167,"Bosque de Los Austriacos Primary Forest-Research Plot, La Gamba",1994.0,1,1,1,,WGS84,2019,"Huber Werner, Weissenhofer Anton"
54931,UNKNOWN,Guarea rhopalocarpa,100082982,GBIF,,Manuel Vargas,,8.68333,-83.2167,"P.N. Piedras Blancas, Bosque Esquinas, Sendero Ozelot - forest in a gorge  (near Esquinas Rainforest Lodge)",2002.0,1,1,1,,WGS84,2019,Arauz Suarez Eduardo Gerrado
54932,UNKNOWN,Guarea rhopalocarpa,100113940,GBIF,,Manuel Vargas,,8.68333,-83.2167,"P.N. Piedras Blancas, Bosque Esquinas, Sendero Ozelot - forest in a gorge  (near Esquinas Rainforest Lodge)",2002.0,1,1,1,,WGS84,2019,Arauz Suarez Eduardo Gerrado
54933,UNKNOWN,Guarea rhopalocarpa,100113941,GBIF,,Manuel Vargas,,8.68333,-83.2167,"P.N. Piedras Blancas, Bosque Esquinas, Sendero Ozelot - forest in a gorge  (near Esquinas Rainforest Lodge)",2002.0,1,1,1,,WGS84,2019,Arauz Suarez Eduardo Gerrado
54934,UNKNOWN,Guarea rhopalocarpa,100113942,GBIF,,Manuel Vargas,,8.68333,-83.2167,"P.N. Piedras Blancas, Bosque Esquinas, Sendero Ozelot - forest in a gorge  (near Esquinas Rainforest Lodge)",2002.0,1,1,1,,WGS84,2019,Arauz Suarez Eduardo Gerrado
54935,UNKNOWN,Guarea rhopalocarpa,100113943,GBIF,,Manuel Vargas,,8.68333,-83.2167,"P.N. Piedras Blancas, Bosque Esquinas, Sendero Ozelot - forest in a gorge  (near Esquinas Rainforest Lodge)",2002.0,1,1,1,,WGS84,2019,Arauz Suarez Eduardo Gerrado
