,BasisOfRec,Binomial,CatalogNo,Citation,CollectID,Compiler,Data_sens,Dec_Lat,Dec_Long,Dist_comm,Event_Year,Origin,Presence,Seasonal,Sens_comm,SpatialRef,YrCompiled,recordedBy
7172,PRESERVED_SPECIMEN,Sloanea herrerae,V0055190F,GBIF,3390,Manuel Vargas,,9.4042,-83.0083,Alto Urén. Inmediaciones Cerro Laubeta,1989.0,1,1,1,,WGS84,2019,G. Herrera C.
13230,PRESERVED_SPECIMEN,Sloanea herrerae,1568442,GBIF,,Manuel Vargas,,9.404167,-83.008333,Alto Uren. Inmediaciones Cerro Laubeta.,1989.0,1,1,1,,WGS84,2019,Gerardo Herrera
27411,PRESERVED_SPECIMEN,Sloanea herrerae,BM000648229,GBIF,3390,Manuel Vargas,,9.404167,-83.008333,"Cantón de Talamanca, Alto Urén, Inmediaciones Cerro Laúbeta",1989.0,1,1,1,,WGS84,2019,Gerardo Antonio del Carmen Herrera Chacón
42940,PRESERVED_SPECIMEN,Sloanea herrerae,02859707,GBIF,3390,Manuel Vargas,,9.4042,-83.0083,"Alto Urén, Inmediaciones Cerro Laúbeta.",1989.0,1,1,1,,WGS84,2019,G. Herrera C.
49030,PRESERVED_SPECIMEN,Sloanea herrerae,180022,GBIF,Hammel 17612,Manuel Vargas,,9.45,-82.99,Reserva Indígena Talamanca Camino entre Sukut y Amubri por la fila Tsiurábeta.,1989.0,1,1,1,,WGS84,2019,Barry E. Hammel|Abelardo Chacón|Jorge F. Corrales|Gerardo Herrera Ch.
49031,PRESERVED_SPECIMEN,Sloanea herrerae,180014,GBIF,Herrera Chacón 3390,Manuel Vargas,,9.4,-83.0,Cantón de Talamanca Alto Urén. Inmediaciones Cerro Laúbeta.,1989.0,1,1,1,,WGS84,2019,Gerardo Herrera Ch.
